venue_name,name,start_date,end_date
TEPIAN NYIUR MELAMBAI,PACU JALUR RAYON I,2025-06-13 14:00:00,2025-06-15 18:00:00
TEPIAN GUDANG PULAU GOBAH,PACU JALUR RAYON II,2025-06-20 14:00:00,2025-06-22 18:00:00
TEPIAN RAJO,PACU JALUR RAYON III,2025-07-04 14:00:00,2025-07-06 18:00:00
TEPIAN DATUAK BANDARO LELO BUDI,PACU JALUR RAYON IV,2025-07-18 14:00:00,2025-07-20 18:00:00
TEPIAN RONGE BIRU,PACU JALUR MINI IKATAN PEMUDA PULAU ARO,2025-07-25 14:00:00,2025-07-27 18:00:00
TEPIAN LUBUK SOBAE,PACU JALUR EVENT KEBUDAYAAN,2025-08-07 14:00:00,2025-08-10 18:00:00
TEPIAN NAROSA,PACU JALUR MINI TELUK KUANTAN,2025-08-16 14:00:00,2025-08-18 18:00:00
TEPIAN NAROSA,FESTIVAL PACU JALUR KARISMA EVENT NUSANTARA,2025-08-20 14:00:00,2025-08-24 18:00:00
